UNIQUE°,ID° ,NAME,INSCRIPTION,LONGITUDE,LATITUDE,HECTARES,CATEGORIE,PAYS,REGIONS
1754,1359,Delta du Saloum,2011,-16.4986111111,13.8352777778,145811.0000,Cultural,Sénégal,Afrique
1832,1407,"Pays Bassari : paysages culturels Bassari, Peul et Bédik",2012,-12.8458333333,12.5933333333,50309.0000,Cultural,Sénégal,Afrique
104,96,Vieux Ras avec Sopoćani,1979,20.4227800000,43.1188900000,198.7200,Cultural,Serbie,Europe et Amérique du nord
449,389,Monastère de Studenica,1986,20.5366700000,43.4861100000,1.1600,Cultural,Serbie,Europe et Amérique du nord
856,724,Monuments médiévaux au Kosovo,2004,20.2655555555,42.6611111111,2.8802,Cultural,Serbie,Europe et Amérique du nord
1430,1253,"Gamzigrad-Romuliana, palais de Galère",2007,22.1861111111,43.8993055556,179.2170,Cultural,Serbie,Europe et Amérique du nord
205,185,Atoll d'Aldabra,1982,46.4166666700,-9.4166666670,35000.0000,Natural,Seychelles,Afrique
291,261,Réserve naturelle de la vallée de Mai,1983,55.7375000000,-4.3291700000,19.5000,Natural,Seychelles,Afrique
2044,1483,Jardins botaniques de Singapour,2015,103.8161111111,1.3152777778,49.0000,Cultural,Singapour,Asie et pacifique
734,618,Ville historique de Banská Štiavnica et les monuments techniques des environs,1993,18.9000000000,48.4611100000,20632.0000,Cultural,Slovaquie,Europe et Amérique du nord
1537,620,"Levoča, Spišský Hrad et les monuments culturels associés",1993,20.7675000000,48.9994444444,1351.2252,Cultural,Slovaquie,Europe et Amérique du nord
740,622,Vlkolínec,1993,19.2783333333,49.0391666667,4.9000,Cultural,Slovaquie,Europe et Amérique du nord
1137,973,Réserve de conservation de la ville de Bardejov,2000,21.2791700000,49.2933300000,23.6000,Cultural,Slovaquie,Europe et Amérique du nord
1491,1273,Églises en bois de la partie slovaque de la zone des Carpates,2008,19.5583333333,49.3361111111,2.5644,Cultural,Slovaquie,Europe et Amérique du nord
450,390,Grottes de Škocjan,1986,14.0000000000,45.6666700000,413.0000,Natural,Slovénie,Europe et Amérique du nord
1005,854,Rennell Est,1998,160.3333300000,-11.6833300000,37000.0000,Natural,Îles Salomon,Asie et pacifique
1067,914,Parc de la zone humide d’iSimangaliso,1999,32.5500000000,-27.8388900000,239566.0000,Natural,Afrique du Sud,Afrique
1069,915,Sites des hominidés fossiles d’Afrique du Sud,1999,29.1769400000,-24.1586100000,0.0000,Cultural,Afrique du Sud,Afrique
1070,916,Robben Island,1999,18.3666666700,-33.8000000000,475.0000,Cultural,Afrique du Sud,Afrique
2013,1007,Aires protégées de la Région Florale du Cap,2004,18.4750000000,-34.3611111111,1094742.0000,Natural,Afrique du Sud,Afrique
2061,1099,Paysage culturel de Mapungubwe,2003,29.2388900000,-22.1925000000,28168.6602,Cultural,Afrique du Sud,Afrique
1342,1162,Dôme de Vredefort,2005,27.2600000000,-26.8600000000,30000.0000,Natural,Afrique du Sud,Afrique
1442,1265,Paysage culturel et botanique du Richtersveld,2007,17.2038888888,-28.6000000000,160000.0000,Cultural,Afrique du Sud,Afrique
1506,310,Grotte d’Altamira et art rupestre paléolithique du nord de l’Espagne,1985,-4.1161666670,43.3825277800,0.0000,Cultural,Espagne,Europe et Amérique du nord
2124,311,Vieille ville de Ségovie et son aqueduc,1985,-4.1167500000,40.9484722200,134.2800,Cultural,Espagne,Europe et Amérique du nord
353,312,Monuments d’Oviedo et du royaume des Asturies,1985,-5.8430300000,43.3626200000,0.2000,Cultural,Espagne,Europe et Amérique du nord
355,313,Centre historique de Cordoue,1984,-4.7797222220,37.8791944400,0.0000,Cultural,Espagne,Europe et Amérique du nord
357,314,"Alhambra, Generalife et Albaicin, Grenade",1984,-3.5944400000,37.1766700000,0.0000,Cultural,Espagne,Europe et Amérique du nord
2070,316,Cathédrale de Burgos,1984,-3.7048138889,42.3405277778,1.0300,Cultural,Espagne,Europe et Amérique du nord
361,318,Monastère et site de l'Escurial (Madrid),1984,-4.1264166670,40.5817500000,94.1100,Cultural,Espagne,Europe et Amérique du nord
364,320,Œuvres d’Antoni Gaudí ,1984,2.1529720000,41.4133800000,0.0000,Cultural,Espagne,Europe et Amérique du nord
395,347,Vieille ville de Saint-Jacques-de-Compostelle,1985,-8.5446800000,42.8807600000,107.5900,Cultural,Espagne,Europe et Amérique du nord
1562,348,Vieille ville d'Ávila avec ses églises extra-muros,1985,-4.7001200000,40.6564500000,0.0000,Cultural,Espagne,Europe et Amérique du nord
2188,378,Architecture mudéjare d’Aragon,1986,-1.1072200000,40.3438900000,4.2690,Cultural,Espagne,Europe et Amérique du nord
435,379,Ville historique de Tolède,1986,-4.0294166670,39.8668888900,259.8500,Cultural,Espagne,Europe et Amérique du nord
436,380,Parc national de Garajonay,1986,-17.2372222200,28.1262500000,3984.0000,Natural,Espagne,Europe et Amérique du nord
439,381,Vieille ville de Salamanque,1988,-5.6645000000,40.9652500000,50.7800,Cultural,Espagne,Europe et Amérique du nord
1747,383,"La Cathédrale, l'Alcázar et l'Archivo de Indias de Séville",1987,-5.9915500000,37.3838400000,12.0000,Cultural,Espagne,Europe et Amérique du nord
2189,384,Vieille ville de Caceres,1986,-6.3700000000,39.4744400000,9.0000,Cultural,Espagne,Europe et Amérique du nord
481,417,"Ibiza, biodiversité et culture",1999,1.4351944440,38.9111388900,11231.0000,Mixed,Espagne,Europe et Amérique du nord
605,518,Monastère de Poblet,1991,1.0825000000,41.3808300000,18.0000,Cultural,Espagne,Europe et Amérique du nord
611,522,Ensembles monumentaux Renaissance de Úbeda et Baeza,2003,-3.3712200000,38.0113100000,9.0000,Cultural,Espagne,Europe et Amérique du nord
785,664,Ensemble archéologique de Mérida,1993,-6.3377800000,38.9161100000,30.7700,Cultural,Espagne,Europe et Amérique du nord
786,665,Monastère royal de Santa María de Guadalupe,1993,-5.3275000000,39.4528500000,1.1000,Cultural,Espagne,Europe et Amérique du nord
2055,669,Chemins de Saint-Jacques-de-Compostelle : <i>Camino francés</i> et chemins du nord de l’Espagne ,1993,-6.4147222222,43.3350000000,14.5800,Cultural,Espagne,Europe et Amérique du nord
810,685,Parc national de Doñana,1994,-6.3588610000,36.9477000000,54251.7000,Natural,Espagne,Europe et Amérique du nord
924,781,Ville historique fortifiée de Cuenca,1996,-2.1317400000,40.0766200000,22.7900,Cultural,Espagne,Europe et Amérique du nord
925,782,La Lonja de la Seda de Valence,1996,-0.3784444440,39.4744166700,0.0000,Cultural,Espagne,Europe et Amérique du nord
949,803,Las Médulas,1997,-6.7707500000,42.4693900000,0.0000,Cultural,Espagne,Europe et Amérique du nord
1631,804,"Palais de la musique catalane et hôpital de Sant Pau, Barcelone",1997,2.1750000000,41.3877800000,,Cultural,Espagne,Europe et Amérique du nord
951,805,Monastères de San Millán de Yuso et de Suso,1997,-2.8649600000,42.3258600000,19.0100,Cultural,Espagne,Europe et Amérique du nord
1026,874,Art rupestre du bassin méditerranéen de la péninsule Ibérique,1998,-1.0333100000,39.7899500000,0.0000,Cultural,Espagne,Europe et Amérique du nord
1027,875,Ensemble archéologique de Tarragone,2000,1.2593055560,41.1147222200,32.6500,Cultural,Espagne,Europe et Amérique du nord
1028,876,Université et quartier historique d'Alcalá de Henares,1998,-3.3680555560,40.4813888900,0.0000,Cultural,Espagne,Europe et Amérique du nord
1084,929,San Cristóbal de la Laguna,1999,-16.3117777800,28.4778888900,60.3800,Cultural,Espagne,Europe et Amérique du nord
1085,930,Palmeraie d’Elche,2000,-0.7166666670,38.2666666700,0.0000,Cultural,Espagne,Europe et Amérique du nord
1151,987,Remparts romains de Lugo,2000,-7.5533300000,43.0111100000,1.6800,Cultural,Espagne,Europe et Amérique du nord
1152,988,Églises romanes catalanes de la Vall de Boí,2000,0.8036111110,42.5047222200,7.9800,Cultural,Espagne,Europe et Amérique du nord
1153,989,Site archéologique d'Atapuerca,2000,-3.5472222220,42.3713888900,284.1190,Cultural,Espagne,Europe et Amérique du nord
1218,1044,Paysage culturel d’Aranjuez,2001,-3.6093400000,40.0364500000,2047.5601,Cultural,Espagne,Europe et Amérique du nord
1394,1217,Pont Vizcaya,2006,-3.0168333333,43.3231750000,0.8595,Cultural,Espagne,Europe et Amérique du nord
1435,1258,Parc national de Teide,2007,-16.6436111111,28.2713888889,18990.0000,Natural,Espagne,Europe et Amérique du nord
1616,1312,Tour d’Hercule,2009,-8.4063888889,43.3858333333,233.0000,Cultural,Espagne,Europe et Amérique du nord
1781,1371,Paysage culturel de la Serra de Tramuntana,2011,2.6947222222,39.7308333333,30745.0000,Cultural,Espagne,Europe et Amérique du nord
2088,1501,Site de dolmens d’Antequera,2016,-4.5444444444,37.0250000000,2446.3000,Cultural,Espagne,Europe et Amérique du nord
221,200,Ville sainte d'Anuradhapura,1982,80.3833333300,8.3333333330,0.0000,Cultural,Sri Lanka,Asie et pacifique
222,201,Cité historique de Polonnaruwa,1982,81.0005555600,7.9158333330,0.0000,Cultural,Sri Lanka,Asie et pacifique
223,202,Ville ancienne de Sigiriya,1982,80.7500000000,7.9500000000,0.0000,Cultural,Sri Lanka,Asie et pacifique
468,405,Réserve forestière de Sinharaja,1988,80.5000000000,6.4166666670,8864.0000,Natural,Sri Lanka,Asie et pacifique
522,450,Ville sacrée de Kandy,1988,80.6402777800,7.2936111110,0.0000,Cultural,Sri Lanka,Asie et pacifique
523,451,Vieille ville de Galle et ses fortifications,1988,80.2186111100,6.0213888890,0.0000,Cultural,Sri Lanka,Asie et pacifique
663,561,Temple d'Or de Dambulla,1991,80.6491666700,7.8566666670,0.0000,Cultural,Sri Lanka,Asie et pacifique
1650,1203,Hauts plateaux du centre de Sri Lanka,2010,80.8021000000,7.4524500000,56844.0000,Natural,Sri Lanka,Asie et pacifique
2177,262,Parc national marin de Sanganeb et Parc national marin de la baie de Dungonab – île de Mukkawar,2016,37.4430555556,19.7361111111,199523.9080,Natural,Soudan,États arabes
1250,1073,Gebel Barkal et les sites de la région napatéenne,2003,31.8166666700,18.5333333300,182.5000,Cultural,Soudan,États arabes
1760,1336,Sites archéologiques de l’île de Méroé,2011,33.7166666667,16.9333333333,2357.3600,Cultural,Soudan,États arabes
1096,940,Centre ville historique de Paramaribo,2002,-55.1500000000,5.8261100000,30.0000,Cultural,Suriname,Amérique latine et Caraïbes
1187,1017,Réserve naturelle du Suriname central,2000,-56.5000000000,4.0000000000,1600000.0000,Natural,Suriname,Amérique latine et Caraïbes
653,555,Birka et Hovgården,1993,17.5426400000,59.3351400000,0.0000,Cultural,Suède,Europe et Amérique du nord
655,556,Forges d'Engelsberg,1993,16.0083300000,59.9666700000,0.0000,Cultural,Suède,Europe et Amérique du nord
657,557,Gravures rupestres de Tanum,1994,11.3411100000,58.7011100000,0.0000,Cultural,Suède,Europe et Amérique du nord
659,558,Skogskyrkogården,1994,18.0994400000,59.2755600000,0.0000,Cultural,Suède,Europe et Amérique du nord
660,559,Domaine royal de Drottningholm,1991,17.8833300000,59.3230600000,0.0000,Cultural,Suède,Europe et Amérique du nord
864,731,Ville hanséatique de Visby,1995,18.2958300000,57.6416700000,0.0000,Cultural,Suède,Europe et Amérique du nord
898,762,"Ville-église de Gammelstad, Luleå",1996,22.0286100000,65.6461100000,0.0000,Cultural,Suède,Europe et Amérique du nord
916,774,Région de Laponie,1996,17.5833300000,67.3333300000,933408.7060,Mixed,Suède,Europe et Amérique du nord
1022,871,Port naval de Karlskrona,1998,15.5833300000,56.1666700000,0.0000,Cultural,Suède,Europe et Amérique du nord
1132,968,Paysage agricole du sud d’Öland,2000,16.4833300000,56.3250000000,56323.0000,Cultural,Suède,Europe et Amérique du nord
1200,1027,Zone d'exploitation minière de la grande montagne de cuivre de Falun,2001,15.6308300000,60.6047200000,42.8200,Cultural,Suède,Europe et Amérique du nord
1314,1134,"Station radio Grimeton, Varberg",2004,12.3833333300,57.1000000000,109.0900,Cultural,Suède,Europe et Amérique du nord
1814,1282,Fermes décorées de Hälsingland,2012,16.1958333333,61.7072222222,14.8400,Cultural,Suède,Europe et Amérique du nord
297,267,Vieille ville de Berne,1983,7.4502800000,46.9480600000,84684.0000,Cultural,Suisse,Europe et Amérique du nord
298,268,Abbaye de St-Gall,1983,9.3777800000,47.4233300000,0.0000,Cultural,Suisse,Europe et Amérique du nord
299,269,Couvent bénédictin Saint-Jean-des-Sœurs à Müstair,1983,10.4476500000,46.6294500000,2036.0000,Cultural,Suisse,Europe et Amérique du nord
1036,884,"Trois châteaux, muraille et remparts du bourg de Bellinzone",2000,9.0224200000,46.1931400000,5.0000,Cultural,Suisse,Europe et Amérique du nord
1211,1037,Alpes suisses Jungfrau-Aletsch,2001,8.0333333333,46.5000000000,82400.0000,Natural,Suisse,Europe et Amérique du nord
1497,1179,Haut lieu tectonique suisse Sardona,2008,9.2500000000,46.9166666667,32850.0000,Natural,Suisse,Europe et Amérique du nord
1420,1243,"Lavaux, vignoble en terrasses",2007,6.7461111111,46.4919444444,898.0000,Cultural,Suisse,Europe et Amérique du nord
1582,1302,"La Chaux-de-Fonds / Le Locle, urbanisme horloger",2009,6.8327777778,47.1038888889,283.9000,Cultural,Suisse,Europe et Amérique du nord
1862,20,Ancienne ville de Damas,1979,36.3063900000,33.5113900000,86.1200,Cultural,République arabe syrienne,États arabes
24,21,Ancienne ville d'Alep,1986,37.1666700000,36.2333300000,364.0000,Cultural,République arabe syrienne,États arabes
25,22,Ancienne ville de Bosra,1980,36.4816700000,32.5180600000,99.8000,Cultural,République arabe syrienne,États arabes
26,23,Site de Palmyre,1980,38.2666700000,34.5541700000,0.3600,Cultural,République arabe syrienne,États arabes
1406,1229,Crac des Chevaliers et Qal’at Salah El-Din,2006,36.2630555555,34.7816666667,8.8700,Cultural,République arabe syrienne,États arabes
1761,1348,Villages antiques du Nord de la Syrie,2011,36.8441666667,36.3341666667,12290.0000,Cultural,République arabe syrienne,États arabes
1651,1141,Sarazm,2010,67.4602777778,39.5077777778,15.9300,Cultural,Tadjikistan,Asie et pacifique
1907,1252,Parc national tadjik (montagnes du Pamir),2013,72.3052777778,38.7650000000,2611674.0000,Natural,Tadjikistan,Asie et pacifique
679,574,Ville historique de Sukhothaï et villes historiques associées,1991,99.7897200000,17.0072200000,11852.0000,Cultural,Thaïlande,Asie et pacifique
680,575,Site archéologique de Ban Chiang,1992,103.3583300000,17.5486100000,30.0000,Cultural,Thaïlande,Asie et pacifique
681,576,Ville historique d’Ayutthaya,1991,100.5605600000,14.3477800000,289.0000,Cultural,Thaïlande,Asie et pacifique
698,590,Complexe forestier de Dong Phayayen-Khao Yai,2005,102.0500000000,14.3300000000,615500.0000,Natural,Thaïlande,Asie et pacifique
699,591,Sanctuaires de faune de Thung Yai-Huai Kha Khaeng,1991,98.9166700000,15.3333300000,622200.0000,Natural,Thaïlande,Asie et pacifique
1714,99,Patrimoine naturel et culturel de la région d’Ohrid,1979,20.8133300000,41.1180600000,83350.0000,Mixed,ex-République yougoslave de Macédoine,Europe et Amérique du nord
1321,1140,"Koutammakou, le pays des Batammariba",2004,1.1333333330,10.0666666700,50000.0000,Cultural,Togo,Afrique
11,8,Parc national de l'Ichkeul,1980,9.6747200000,37.1636100000,12600.0000,Natural,Tunisie,États arabes
1744,36,Médina de Tunis,1979,10.1666700000,36.8166700000,296.4100,Cultural,Tunisie,États arabes
41,37,Site archéologique de Carthage,1979,10.3233300000,36.8527800000,616.0200,Cultural,Tunisie,États arabes
1741,38,Amphithéâtre d'El Jem,1979,10.7069400000,35.2963900000,1.3700,Cultural,Tunisie,États arabes
378,332,Cité punique de Kerkouane et sa nécropole,1985,11.0991700000,36.9463900000,0.0000,Cultural,Tunisie,États arabes
1743,498,Médina de Sousse,1988,10.6386100000,35.8277800000,31.6800,Cultural,Tunisie,États arabes
1742,499,Kairouan,1988,10.1038900000,35.6816700000,68.0200,Cultural,Tunisie,États arabes
938,794,Dougga / Thugga,1997,9.2202800000,36.4236100000,70.0000,Cultural,Tunisie,États arabes
409,356,Zones historiques d'Istanbul,1985,28.9799300000,41.0084700000,678.0000,Cultural,Turquie,Europe et Amérique du nord
410,357,Parc national de Göreme et sites rupestres de Cappadoce,1985,34.8500000000,38.6666700000,9883.8100,Mixed,Turquie,Europe et Amérique du nord
411,358,Grande mosquée et hôpital de Divriği,1985,38.1218260000,39.3712710000,2016.0000,Cultural,Turquie,Europe et Amérique du nord
432,377,Hattousa : la capitale hittite,1986,34.6205600000,40.0138900000,268.4600,Cultural,Turquie,Europe et Amérique du nord
520,448,Nemrut Dağ,1987,38.7636900000,38.0366100000,11.0000,Cultural,Turquie,Europe et Amérique du nord
563,484,Xanthos-Letoon,1988,29.3202800000,36.3350000000,126.4000,Cultural,Turquie,Europe et Amérique du nord
564,485,Hierapolis-Pamukkale,1988,29.1233300000,37.9238900000,1077.0000,Mixed,Turquie,Europe et Amérique du nord
729,614,Ville de Safranbolu,1994,32.6897200000,41.2600000000,193.0000,Cultural,Turquie,Europe et Amérique du nord
1000,849,Site archéologique de Troie,1998,26.2390000000,39.9564400000,158.0000,Cultural,Turquie,Europe et Amérique du nord
2014,1018,Éphèse,2015,27.3594444444,37.9291666667,662.6200,Cultural,Turquie,Europe et Amérique du nord
1784,1366,Mosquée Selimiye et son ensemble social,2011,26.5594444444,41.6777777778,2.5000,Cultural,Turquie,Europe et Amérique du nord
1829,1405,Site néolithique de Çatal Höyük,2012,32.8280555556,37.6666666667,37.0000,Cultural,Turquie,Europe et Amérique du nord
1995,1452,Bursa et Cumalıkızık : la naissance de l’Empire ottoman,2014,29.0623361111,40.1847305556,27.4670,Cultural,Turquie,Europe et Amérique du nord
2001,1457,Pergame et son paysage culturel à multiples strates,2014,27.1800000000,39.1258333333,332.5000,Cultural,Turquie,Europe et Amérique du nord
2049,1488,Paysage culturel de la forteresse de Diyarbakır et des jardins de l’Hevsel,2015,40.2393083333,37.9031000000,521.2300,Cultural,Turquie,Europe et Amérique du nord
2110,1518,Site archéologique d’Ani,2016,43.5666666667,40.5000000000,250.7000,Cultural,Turquie,Europe et Amérique du nord
1038,886,Parc national historique et culturel de l’« Ancienne Merv »,1999,62.1775000000,37.7008300000,353.2400,Cultural,Turkménistan,Asie et pacifique
1376,1199,Kunya-Urgench,2005,59.0849400000,42.1831800000,0.0000,Cultural,Turkménistan,Asie et pacifique
1471,1242,Forteresses parthes de Nisa,2007,58.1986111111,37.9997222222,77.9050,Cultural,Turkménistan,Asie et pacifique
806,682,Forêt impénétrable de Bwindi,1994,29.6613888900,-1.0805555560,32092.0000,Natural,Ouganda,Afrique
808,684,Monts Rwenzori,1994,29.9241666700,0.2236111110,99600.0000,Natural,Ouganda,Afrique
1192,1022,Tombes des rois du Buganda à Kasubi,2001,32.5513888900,0.3486111110,26.8000,Cultural,Ouganda,Afrique
617,527,Kiev : cathédrale Sainte-Sophie et ensemble des bâtiments monastiques et laure de Kievo-Petchersk,1990,30.5168600000,50.4525800000,28.5200,Cultural,Ukraine,Europe et Amérique du nord
1632,865,Lviv – ensemble du centre historique,1998,24.0319800000,49.8416300000,120.0000,Cultural,Ukraine,Europe et Amérique du nord
1785,1330,Résidence des métropolites de Bucovine et de Dalmatie,2011,25.9247222222,48.2966666667,8.0000,Cultural,Ukraine,Europe et Amérique du nord
1895,1411,Cité antique de Chersonèse Taurique et sa chôra,2013,33.4913888889,44.6108333333,259.3752,Cultural,Ukraine,Europe et Amérique du nord
1762,1343,"Sites culturels d’Al Aïn (Hafit, Hili, Bidaa Bint Saud et les oasis)",2011,55.8063888889,24.0677777778,4945.4500,Cultural,Émirats arabes unis,États arabes
2178,369,Chaussée des Géants et sa côte,1986,-6.4852777780,55.2500000000,239.4050,Natural,Royaume-Uni de Grande-Bretagne et d'Irlande du Nord,Europe et Amérique du nord
1634,370,Cathédrale et château de Durham,1986,-1.5761111110,54.7747222200,8.7900,Cultural,Royaume-Uni de Grande-Bretagne et d'Irlande du Nord,Europe et Amérique du nord
425,371,Gorge d'Ironbridge,1986,-2.4727777780,52.6263888900,0.0000,Cultural,Royaume-Uni de Grande-Bretagne et d'Irlande du Nord,Europe et Amérique du nord
1930,372,Parc de Studley Royal avec les ruines de l'abbaye de Fountains,1986,-1.5730555560,54.1161111100,309.0000,Cultural,Royaume-Uni de Grande-Bretagne et d'Irlande du Nord,Europe et Amérique du nord
1633,373,"Stonehenge, Avebury et sites associés",1986,-1.8252777780,51.1788888900,4985.4000,Cultural,Royaume-Uni de Grande-Bretagne et d'Irlande du Nord,Europe et Amérique du nord
429,374,Châteaux forts et enceintes du roi Édouard Ier dans l'ancienne principauté de Gwynedd,1986,-4.2769444440,53.1397222200,6.0000,Cultural,Royaume-Uni de Grande-Bretagne et d'Irlande du Nord,Europe et Amérique du nord
2202,387,Île de St Kilda,1986,-8.5766666670,57.8172222200,24201.4004,Mixed,Royaume-Uni de Grande-Bretagne et d'Irlande du Nord,Europe et Amérique du nord
492,425,Palais de Blenheim,1987,-1.3613888890,51.8419444400,0.0000,Cultural,Royaume-Uni de Grande-Bretagne et d'Irlande du Nord,Europe et Amérique du nord
1635,426,Palais de Westminster et l'abbaye de Westminster incluant l'église Sainte-Marguerite,1987,-0.1286111110,51.4997222200,10.2600,Cultural,Royaume-Uni de Grande-Bretagne et d'Irlande du Nord,Europe et Amérique du nord
495,428,Ville de Bath,1987,-2.3586111110,51.3813888900,2900.0000,Cultural,Royaume-Uni de Grande-Bretagne et d'Irlande du Nord,Europe et Amérique du nord
497,429,New Lanark,2001,-3.7830555560,55.6633333300,146.0000,Cultural,Royaume-Uni de Grande-Bretagne et d'Irlande du Nord,Europe et Amérique du nord
566,487,Île d'Henderson,1988,-128.3333333330,-24.3666666667,3700.0000,Natural,Royaume-Uni de Grande-Bretagne et d'Irlande du Nord,Europe et Amérique du nord
567,488,Tour de Londres,1988,-0.0761111110,51.5080555600,0.0000,Cultural,Royaume-Uni de Grande-Bretagne et d'Irlande du Nord,Europe et Amérique du nord
578,496,"Cathédrale, abbaye Saint-Augustin et église Saint-Martin à Cantorbéry",1988,1.0833333330,51.2800000000,18.1700,Cultural,Royaume-Uni de Grande-Bretagne et d'Irlande du Nord,Europe et Amérique du nord
2125,514,Coeur néolithique des Orcades,1999,-3.1886666670,58.9960555600,15.0000,Cultural,Royaume-Uni de Grande-Bretagne et d'Irlande du Nord,Europe et Amérique du nord
860,728,Vieille ville et Nouvelle ville d'Edimbourg,1995,-3.2166666670,55.9500000000,0.0000,Cultural,Royaume-Uni de Grande-Bretagne et d'Irlande du Nord,Europe et Amérique du nord
874,740,Îles de Gough et Inaccessible,1995,-9.9286111110,-40.3247222200,7900.0000,Natural,Royaume-Uni de Grande-Bretagne et d'Irlande du Nord,Europe et Amérique du nord
939,795,Maritime Greenwich,1997,0.0000000000,51.4777777800,109.5000,Cultural,Royaume-Uni de Grande-Bretagne et d'Irlande du Nord,Europe et Amérique du nord
1147,983,"Ville historique de St George et les fortifications associées, aux Bermudes",2000,-64.6777777800,32.3794444400,257.5000,Cultural,Royaume-Uni de Grande-Bretagne et d'Irlande du Nord,Europe et Amérique du nord
1148,984,Paysage industriel de Blaenavon,2000,-3.0880555560,51.7763888900,3290.0000,Cultural,Royaume-Uni de Grande-Bretagne et d'Irlande du Nord,Europe et Amérique du nord
1201,1028,Saltaire,2001,-1.7883333330,53.8391666700,20.0000,Cultural,Royaume-Uni de Grande-Bretagne et d'Irlande du Nord,Europe et Amérique du nord
1202,1029,Littoral du Dorset et de l'est du Devon,2001,-2.9898888890,50.7055555600,2550.0000,Natural,Royaume-Uni de Grande-Bretagne et d'Irlande du Nord,Europe et Amérique du nord
1203,1030,Usines de la vallée de la Derwent,2001,-1.4880555560,53.0288888900,1228.7000,Cultural,Royaume-Uni de Grande-Bretagne et d'Irlande du Nord,Europe et Amérique du nord
1262,1084,Jardins botaniques royaux de Kew,2003,-0.2940277780,51.4819444400,132.0000,Cultural,Royaume-Uni de Grande-Bretagne et d'Irlande du Nord,Europe et Amérique du nord
1331,1150,Liverpool – Port marchand,2004,-2.9944444440,53.4066666700,136.0000,Cultural,Royaume-Uni de Grande-Bretagne et d'Irlande du Nord,Europe et Amérique du nord
1392,1215,Paysage minier des Cornouailles et de l’ouest du Devon,2006,-5.3836111111,50.1361111111,19719.0000,Cultural,Royaume-Uni de Grande-Bretagne et d'Irlande du Nord,Europe et Amérique du nord
1583,1303,Pont-canal et canal de Pontcysyllte,2009,-3.0877777778,52.9702777778,105.0000,Cultural,Royaume-Uni de Grande-Bretagne et d'Irlande du Nord,Europe et Amérique du nord
2046,1485,Le pont du Forth	,2015,-3.3888888889,56.0011111111,7.5000,Cultural,Royaume-Uni de Grande-Bretagne et d'Irlande du Nord,Europe et Amérique du nord
2087,1500,Ensemble des grottes de Gorham,2016,-5.3420611111,36.1226694444,28.0000,Cultural,Royaume-Uni de Grande-Bretagne et d'Irlande du Nord,Europe et Amérique du nord
1639,39,Zone de conservation de Ngorongoro,1979,35.5408300000,-3.1872200000,809440.0000,Mixed,République-Unie de Tanzanie,Afrique
159,144,Ruines de Kilwa Kisiwani et de Songo Mnara,1981,39.5227800000,-8.9577800000,0.0000,Cultural,République-Unie de Tanzanie,Afrique
174,156,Parc national de Serengeti,1981,34.5666700000,-2.3333300000,1476300.0000,Natural,République-Unie de Tanzanie,Afrique
192,173,La ville de pierre de Zanzibar,2000,39.1891700000,-6.1630600000,96.0000,Cultural,République-Unie de Tanzanie,Afrique
1924,199,Réserve de gibier de Selous,1982,37.4000000000,-9.0000000000,5120000.0000,Natural,République-Unie de Tanzanie,Afrique
466,403,Parc national du Kilimandjaro,1987,37.3666700000,-3.0666700000,75575.0000,Natural,République-Unie de Tanzanie,Afrique
1449,1183,Sites d’art rupestre de Kondoa,2006,35.8338888888,-4.7244444444,233600.0000,Cultural,République-Unie de Tanzanie,Afrique
30,27,Parc national de Mesa Verde,1978,-108.4855556000,37.2616666700,21043.0000,Cultural,États-Unis d'Amérique,Europe et Amérique du nord
31,28,Parc national de Yellowstone,1978,-110.8277800000,44.4605600000,898349.0000,Natural,États-Unis d'Amérique,Europe et Amérique du nord
81,75,Parc national du Grand Canyon,1979,-112.0905556000,36.1008333300,493270.0000,Natural,États-Unis d'Amérique,Europe et Amérique du nord
82,76,Parc national des Everglades,1979,-80.9963888900,25.5544444400,567017.0000,Natural,États-Unis d'Amérique,Europe et Amérique du nord
84,78,Independence Hall,1979,-75.1500000000,39.9486111100,2.0000,Cultural,États-Unis d'Amérique,Europe et Amérique du nord
